{
  "platform_version_id": "66666666-6666-4666-8666-666666666666",
  "workspace_id": "22222222-2222-4222-8222-222222222222",
  "revision_id": "44444444-4444-4444-8444-444444444444",
  "platform": "youtube",
  "account_reference": "review-target-youtube",
  "account_display_name": "YouTube review target",
  "title": "Autumn launch",
  "description": "Prepared for review only.",
  "privacy_status": "private",
  "made_for_kids": false,
  "validation_status": "valid",
  "created_at": "2026-08-21T10:00:00.000Z",
  "updated_at": "2026-08-21T10:00:00.000Z"
}
